{
  "stage": "ready",
  "questions": [],
  "concept_options": [],
  "assumptions": [],
  "map_spec": {
    "version": "1.0",
    "id": "lantern-marches",
    "revision": 1,
    "title": "The Lantern Marches",
    "map_type": "regional",
    "purpose": "Player-facing exploration atlas for choosing routes between a fortified city, wild country and uncanny landmarks. Not a token-scale battlemap.",
    "inspiration": {
      "premise": "A river kingdom survives under an ancient astronomical citadel, while three glass monoliths awaken on its eastern frontier.",
      "mood": [
        "wonder",
        "weathered grandeur",
        "inviting mystery"
      ],
      "novelty": "balanced",
      "motifs": [
        "bronze astronomical circles",
        "pale limestone",
        "amber reeds"
      ],
      "references": [
        {
          "id": "regional-reference",
          "kind": "description",
          "source": "Visual observations from the user-provided regional-map screenshot; image bytes are not bundled.",
          "role": "style",
          "use_traits": [
            "fine hand-inked terrain",
            "restrained watercolor washes",
            "pictorial mountains and buildings within overhead geography",
            "one dominant architectural landmark",
            "varied regional silhouettes"
          ],
          "ignore_traits": [
            "original place names and exact geography",
            "numbered hex overlay",
            "mouse pointer",
            "interface pins",
            "cropped banner"
          ]
        }
      ]
    },
    "canvas": {
      "aspect_ratio": [
        16,
        9
      ],
      "target_pixels": [
        3840,
        2160
      ],
      "margin_fraction": 0.03
    },
    "style": {
      "preset": "illustrated_adventure_atlas",
      "perspective": "illustrated_oblique",
      "medium": "Fine ink-and-watercolor fantasy cartography with carefully drawn miniature architecture.",
      "linework": "Thin charcoal contours; finer hatching inside landforms; distinct silhouettes without heavy comic outlines.",
      "palette": {
        "water": "#728B9A",
        "forest": "#899779",
        "stone": "#B5B5A8",
        "accent": "#B77543",
        "paper": "#E5E0D3"
      },
      "surface_texture": "Subtle matte paper tooth, not distressed parchment stains. Low-contrast texture in open land and water.",
      "lighting": "Soft overcast daylight with light coming from upper left; gentle relief shading, no cast shadows hiding paths.",
      "density": "dense",
      "focal_entity_id": "citadel",
      "hierarchy": [
        "citadel",
        "glass_spires",
        "river",
        "copper_marsh",
        "south_port"
      ],
      "border_treatment": "none; edge-to-edge geographic artwork"
    },
    "environment": {
      "terrain_summary": "A broad south-draining valley between a wooded western slope and a steep eastern plateau. Northern mountains frame the citadel; the southern river mouth opens to the sea.",
      "season": "early autumn",
      "time_of_day": "late morning",
      "weather": "clear air under thin cloud",
      "physical_logic": "mythic",
      "exceptions": [
        "The three glass spires are supernatural constructions; their shapes need not follow natural geology. Rivers and travel routes otherwise follow plausible terrain."
      ]
    },
    "entities": {
      "citadel": {
        "name": "Crown of Tides",
        "kind": "fort",
        "visibility": "public",
        "importance": "primary",
        "quantity": 1,
        "placement": {
          "bounds": [
            0.43,
            0.16,
            0.22,
            0.2
          ]
        },
        "appearance": "A compact limestone city on a low escarpment, encircled by terraced walls and crowned by a single enormous tilted bronze astronomical ring. The ring is the unique regional silhouette.",
        "must_show": [
          "one oversized bronze ring, not a skull",
          "three stepped wall terraces",
          "one clear south-facing approach"
        ],
        "must_avoid": [
          "a second ring",
          "a floating city",
          "a skull-shaped tower"
        ],
        "gameplay_role": "Main destination and navigational anchor",
        "gm_notes": ""
      },
      "western_wood": {
        "name": "The Pale Boughs",
        "kind": "forest",
        "visibility": "public",
        "importance": "ambient",
        "quantity": 1,
        "placement": {
          "bounds": [
            0.06,
            0.24,
            0.27,
            0.37
          ]
        },
        "appearance": "A dense wedge of white-barked forest with a few leaning old trunks and small clearings, drawn as coherent wooded masses rather than evenly scattered tree icons.",
        "must_show": [
          "two or three broad clearings"
        ],
        "must_avoid": [],
        "gameplay_role": "A slower wilderness route on the west side of the valley",
        "gm_notes": ""
      },
      "northern_ridge": {
        "name": "The Rimeback",
        "kind": "mountain",
        "visibility": "public",
        "importance": "ambient",
        "quantity": 1,
        "placement": {
          "bounds": [
            0.33,
            0.035,
            0.6,
            0.12
          ]
        },
        "appearance": "An irregular chain of pale angular peaks, taller to the northeast, lower at the central pass.",
        "must_show": [
          "a visible central pass"
        ],
        "must_avoid": [],
        "gameplay_role": "Northern geographic boundary",
        "gm_notes": ""
      },
      "glass_spires": {
        "name": "The Three Listeners",
        "kind": "landmark",
        "visibility": "public",
        "importance": "primary",
        "quantity": 3,
        "placement": {
          "bounds": [
            0.75,
            0.3,
            0.19,
            0.34
          ]
        },
        "appearance": "Exactly three tall, narrow smoky-glass monoliths rise from a flat basalt shelf. One is visibly tilted, one split at its top, and one intact. Space them so they remain individually countable.",
        "must_show": [
          "exactly three separate monoliths",
          "three different silhouettes",
          "a visible ascending trail from the west"
        ],
        "must_avoid": [
          "extra miniature spires",
          "floating rocks"
        ],
        "gameplay_role": "Eastern exploration objective visible from far away",
        "gm_notes": ""
      },
      "copper_marsh": {
        "name": "The Ember Reeds",
        "kind": "terrain",
        "visibility": "public",
        "importance": "supporting",
        "quantity": 1,
        "placement": {
          "bounds": [
            0.59,
            0.7,
            0.21,
            0.17
          ]
        },
        "appearance": "A low copper-and-rust reed marsh with dark pools and a few raised hummocks, providing the sole warm color mass in the lower-right region.",
        "must_show": [
          "water visible between reed masses"
        ],
        "must_avoid": [],
        "gameplay_role": "A hazardous optional detour, not a wall of vegetation",
        "gm_notes": ""
      },
      "river": {
        "name": "The Lowwater",
        "kind": "river",
        "visibility": "public",
        "importance": "supporting",
        "quantity": 1,
        "placement": {
          "bounds": [
            0.32,
            0.32,
            0.25,
            0.64
          ],
          "path": [
            [
              0.54,
              0.34
            ],
            [
              0.55,
              0.41
            ],
            [
              0.52,
              0.48
            ],
            [
              0.51,
              0.55
            ],
            [
              0.49,
              0.64
            ],
            [
              0.44,
              0.74
            ],
            [
              0.37,
              0.85
            ],
            [
              0.34,
              0.95
            ]
          ]
        },
        "appearance": "A connected slate-blue river descending from below the citadel through the valley and into a small southern delta. Keep upstream narrower and downstream broader.",
        "must_show": [
          "one continuous connected watercourse",
          "a visible southern outlet"
        ],
        "must_avoid": [
          "water flowing uphill",
          "random disconnected river fragments"
        ],
        "gameplay_role": "Divides travel choices and establishes the valley direction",
        "gm_notes": ""
      },
      "stone_bridge": {
        "name": "The Last Arch",
        "kind": "bridge",
        "visibility": "public",
        "importance": "supporting",
        "quantity": 1,
        "placement": {
          "bounds": [
            0.465,
            0.525,
            0.1,
            0.06
          ]
        },
        "appearance": "A single worn pale-stone arch spanning the narrow river, with visibly connected approaches on both banks.",
        "must_show": [
          "both bridge ends meet land",
          "the river remains visible below the arch"
        ],
        "must_avoid": [],
        "gameplay_role": "A strategically legible chokepoint",
        "gm_notes": ""
      },
      "south_port": {
        "name": "Lantern Quay",
        "kind": "settlement",
        "visibility": "public",
        "importance": "supporting",
        "quantity": 1,
        "placement": {
          "bounds": [
            0.25,
            0.83,
            0.15,
            0.11
          ]
        },
        "appearance": "A small fishing and caravan port on the western river mouth, with clustered low roofs, two short jetties and a warm beacon tower.",
        "must_show": [
          "two short jetties",
          "one small beacon tower"
        ],
        "must_avoid": [],